title,url,type,date,summary
#078 - Education > school,https://opened.co/newsletter/078---education-school,daily,2024-11-18,"A father's heartfelt manifesto, the truth about tech in learning, and how to make history come alive"
#101 - When Builders Become Architects,https://opened.co/newsletter/101---when-builders-become-architects,daily,2024-12-19,"A construction worker redesigns education, MinutePhysics makes science simple, and why the public vs. private school war is finally ending."
"New Jersey Governor: ""Enough is Enough""🐴 #114",https://opened.co/newsletter/new-jersey-governor-enough-is-enough-114,daily,2025-01-16,Psychologist Jonathan Haidt on childhood fragility... and how to give new life to your dried-up Crayola markers
"🐴 Skip Stanford, Buy a Business: The New Success Formula (#118)",https://opened.co/newsletter/skip-stanford-buy-a-business-the-new-success-formula-118,daily,2025-01-22,"The unexpected path from honey to geometry, why plumbers might be the new tech bros, and the secret sauce for spelling success."
🐴 3 ways to cut teaching time in half without sacrificing results (#125),https://opened.co/newsletter/3-ways-to-cut-teaching-time-in-half-without-sacrificing-results-125,daily,2025-01-31,"From skatepark physics to Hollywood filmmakers, how innovative educators are revolutionizing learning speed. Plus: Texas proposes $10k student freedom accounts, and the Math Crisis deepens."
🐴 The false choice,https://opened.co/newsletter/the-false-choice,daily,2025-02-26,"Education is moving past the school/homeschool binary. See the 220% microschool rise, hybrid models, and research-backed early literacy tools."
🐴 This education trend has seen a 220% increase,https://opened.co/newsletter/this-education-trend-has-seen-a-220-increase,daily,2025-02-28,(Hint: it's microschooling) PLUS: Tonight's rare planetary alignment & Feynman's technique for true learning.
🐴 Handy guide to free curriculum,https://opened.co/newsletter/handy-guide-to-free-curriculum,daily,2025-03-07,How to optimize home education (without breaking the bank). PLUS: The cure for self-doubt.
The math is broken: College's ROI problem,https://opened.co/newsletter/the-math-is-broken-colleges-roi-problem,daily,2025-03-13,"Google, Apple, and Tesla have removed degree requirements. Does that mean college isn't worth it anymore? PLUS: The 6-month alternative that's creating better career outcomes without debt."
🐴 Weekly Roundup: The College ROI Question,https://opened.co/newsletter/weekly-roundup-the-college-roi-question,daily,2025-03-14,From tech layoffs to degree-free hiring: How the returns on a traditional college education have changed. PLUS: Alternative career paths for smart teens.
"🐴 Access 75,000 free books without Amazon",https://opened.co/newsletter/access-75-000-free-books-without-amazon,daily,2025-03-17,Jeremy Caplan reveals a treasure trove of free reading resources that expand your child's learning world without expanding your budget. PLUS: Becoming an educational architect.
🎙️ This mom turned a van into a microschool,https://opened.co/newsletter/this-mom-turned-a-van-into-a-microschool,daily,2025-03-19,From mobile classrooms to kitchen table co-ops - the micro-community movement is changing education. PLUS: How to start your own microschool.
🐴 Weekly Roundup: A Brief Guide to Building Educational Micro-communities,https://opened.co/newsletter/weekly-roundup-a-brief-guide-to-building-educational-micro-communities,daily,2025-03-21,Discover how micro-communities and specialized educators are reshaping personalized education. PLUS: A free life hack to vet YouTube videos and podcasts for inappropriate content.
🐴 AI tutors are advancing quickly: should you try one?,https://opened.co/newsletter/ai-tutors-are-advancing-quickly-should-you-try-one,daily,2025-03-24,Discover how AI tutors are revolutionizing personalized learning and which ones families are raving about. PLUS: The surprising grammar rules we all know without ever being taught.
🐴 Why learning should look like failing,https://opened.co/newsletter/why-learning-should-look-like-failing,daily,2025-03-26,"Seth Godin reveals why mistakes are essential to real learning. PLUS: The startling math about how little time you have with your kids, and turning family photos into Studio Ghibli art."
🐴 Weekly Roundup: How to build a 'self-managing family' (from a mom of 7),https://opened.co/newsletter/weekly-roundup-how-to-build-a-self-managing-family-from-a-mom-of-7,daily,2025-03-28,"From AI tutors to Miyazaki-style family photos, what our fascination with artificial creativity reveals about being human..."
🐴 Your child isn't broken (but their chair might be),https://opened.co/newsletter/your-child-isnt-broken-but-their-chair-might-be,daily,2025-04-02,Traditional schools diagnose fidgety kids. Smart parents redesign their environment instead. PLUS: How to build a complete learning haven for under $100.
🐴 The 3.4 GPA Student Who Couldn't Read,https://opened.co/newsletter/the-3-4-gpa-student-who-couldnt-read,daily,2025-04-03,A shocking case from Tennessee reveals how a student graduated with honors but couldn't read his own diploma. Plus: Why mastery-based learning might be the solution.
🐴 Weekly Roundup: When Good Grades Hide Systemic Failure,https://opened.co/newsletter/weekly-roundup-when-good-grades-hide-systemic-failure,daily,2025-04-04,From a 3.4 GPA student who couldn't read to why Silicon Valley's education secret is finally leaking out... PLUS: The AI tool that matches your child with the perfect curriculum in minutes.
🐴 The Tebow Effect (when being different pays off),https://opened.co/newsletter/the-tebow-effect-when-being-different-pays-off,daily,2025-04-07,"Tim Tebow reveals how homeschooling shaped his success and why being ""different"" can be a strength. PLUS: Simple transcript solutions and why our education system punishes what the real world rewards."
🐴 Why John Taylor Gatto Quit,https://opened.co/newsletter/why-john-taylor-gatto-quit,daily,2025-04-09,An award-winning teacher reveals why he quit at the peak of his career. PLUS: Why phonics isn't enough to improve reading scores & 5 mental razors for better educational decisions.
🐴 Print Your Own Diploma (Weekly Roundup),https://opened.co/newsletter/print-your-own-diploma-weekly-roundup,daily,2025-04-11,"From valedictorian's empty victory to homeschool diplomas at the Mayo Clinic, why traditional credentials matter less than you think..."
🐴 Personal tutors for all (Sal Khan's latest promise),https://opened.co/newsletter/personal-tutors-for-all-sal-khans-latest-promise,daily,2025-04-16,Khan Academy's AI tutoring tool makes big claims. Plus: How to know what's in your child's books before they read them.
"🐴 Nobel Prize winner: ""I don't believe in honors""",https://opened.co/newsletter/nobel-prize-winner-i-dont-believe-in-honors,daily,2025-04-22,"Nobel physicist Richard Feynman's rejection of external validation offers a powerful lesson for education. PLUS: What's really happening at the Department of Education, and how to navigate a massive homeschool resource database."
🐴 Why Ansel Adams' father pulled him out of school,https://opened.co/newsletter/why-ansel-adams-father-pulled-him-out-of-school,daily,2025-04-23,"When Ansel Adams was 12, his father pulled him from school and gave him a pass to the World's Fair instead. The result? One of America's most celebrated artists. Plus: what kindergartners really need (and it's not more worksheets)."
Welcome to the OpenEd Daily,https://opened.co/newsletter/students-arent-standard,daily,2024-08-01,The world is changing. Education is catching up.
Back-to-School Boost: Brain Breaks & Resilient Kids,https://opened.co/newsletter/back-to-school-boost-brain-breaks-resilient-kids,daily,2024-08-02,Why more breaks could be what your child needs to get unstuck
Unbundling Education (and Why It Matters),https://opened.co/newsletter/unbundling-education-and-why-it-matters,daily,2024-08-06,"Bite-sized brain food on the future of learning: podcast highlights with Michael B. Horn, homeschooling’s rapid rise, what “unbundling” education means, and a magical demo of kid-powered AI coding."
A few questions about the launch of OpenEd,https://opened.co/newsletter/questions-launch-opened,daily,2024-08-05,Where we're going
When someone asks if you homeschool...,https://opened.co/newsletter/someone-asks-homeschool,daily,2024-08-08,It's time for a new language in education
Is a college degree still worth it?,https://opened.co/newsletter/college-degree-still-worth,daily,2024-08-07,College at 16? Rethinking higher ed & forging new paths.
The Power of Open Education,https://opened.co/newsletter/weekly-rundown-the-power-of-open-education,daily,2024-08-09,5 tidbits you might have missed this week
Teaching outside the classroom,https://opened.co/newsletter/teaching-outside-classroom,daily,2024-08-12,Meet the mom who went back to school to better support her kids' unique learning needs
"What is a ""good job""?",https://opened.co/newsletter/good-job,daily,2024-08-14,Mike Rowe (the Dirty Jobs guy) thinks CTE is the Future of Education
🍎 The Great Enrollment Shuffle (tl;dr Tuesday),https://opened.co/newsletter/great-enrollment-shuffle-tldr-tuesday,daily,2024-08-13,"Why we're OpenEd now, the rise of the microschooling ecosystem, and the decline of public school enrollment"
Tech-savvy teens will win the future,https://opened.co/newsletter/techsavvy-teens-will-win-future,daily,2024-08-15,And why industry isn't satisfied with the current educational system
The Weekly Rundown: Learning Beyond School,https://opened.co/newsletter/the-weekly-rundown-learning-beyond-school,daily,2024-08-16,3 quick tidbits you might have missed this week
The Homeschool-to-Founder Pipeline,https://opened.co/newsletter/the-homeschool-to-founder-pipeline,daily,2024-08-20,"AI, edupreneurs, and brain-boosting audiobooks"
Matt Bowman // What if we graded LeBron James like a student?,https://opened.co/newsletter/matt-bowman-graded-lebron-james-like-student,daily,2024-08-21,"Roger Federer, LeBron James, and Simone Biles would be academic underperformers. Here's why that matters for education."
The end of one-size-fits-all?,https://opened.co/newsletter/end-onesizefitsall,daily,2024-08-22,"Michael B. Horn on the ""unbundling"" of standardized schooling"
"🍎 The OpenEd Weekly: Rethinking Education from LeBron to ""Back-to-School""",https://opened.co/newsletter/opened-weekly-rethinking-education-lebron-backtoschool,daily,2024-08-23,4 tidbits you may have missed this week
Matt Bowman // You're a trailblazer,https://opened.co/newsletter/matt-bowman-youre-trailblazer,daily,2024-08-26,(and here's why your friends need to know)
🍎  tl;dr Tuesday: The New Science of Raising Happy Kids,https://opened.co/newsletter/tldr-tuesday-new-science-raising-happy-kids,daily,2024-09-03,A 50+ year-long study reveals the secret sauce of parenting and educating
📬 Mailbag: Do You Need a Diploma for Success?,https://opened.co/newsletter/mailbag-need-diploma-success,daily,2024-08-28,One parent's dilemma sparks a discussion on non-traditional paths to college and career success. Plus: How our CEO got into college without a diploma!
She almost gave up on education,https://opened.co/newsletter/almost-gave-education,daily,2024-08-29,"From college dropout to leading thousands of OpenEd learners, Andrea Fife explains how personalization changes everything—along with episode highlights and details on available Makerspace classes at Thanksgiving Point."
🍎 The OpenEd Weekly: Breaking Boundaries in Education,https://opened.co/newsletter/opened-weekly-breaking-boundaries-education,daily,2024-08-30,3 tidbits you may have missed this week
Confession: I played with LEGO instead of doing math,https://opened.co/newsletter/confession-played-lego-instead-math,daily,2024-09-02,"How ""wasting time"" with plastic bricks shaped my future (and why it's okay if your kid hates Saxon Math)"
Worldschooling Without the Plane Ticket,https://opened.co/newsletter/worldschooling-without-the-plane-ticket,daily,2024-09-04,"Worldschooling, Free Reading App, and a Pickleball Prodigy"
Deschooling vs. Unschooling,https://opened.co/newsletter/deschooling-vs-unschooling,daily,2024-09-05,"Hannah Frankman (@RebelEducator) on 'deschooling' plus 5 philosophical ""razors"" to sharpen your critical thinking"
🍎 The OpenEd Weekly: From LEGO learning to happy kids,https://opened.co/newsletter/opened-weekly-lego-learning-happy-kids,daily,2024-09-08,5 tidbits you may have missed this week
🍎  tl;dr Tuesday: 100 million views and counting... but,https://opened.co/newsletter/tldr-tuesday-100-million-views-counting,daily,2024-09-10,Sir Ken Robinson's Revolutionary TED talk is the Most-Watched Lesson Never Learned
Quick question for you,https://opened.co/newsletter/quick-question,daily,2024-09-11,From word of mouth to learning out loud
#030 - Conditioning vs. Education,https://opened.co/newsletter/conditioning-vs-education,daily,2024-09-12,Humans are born learners. How can we foster kids' curiosity in ways that let them grow?
#031 - Weekly Roundup: The Most-Watched Lesson Never Learned,https://opened.co/newsletter/weekly-roundup-mostwatched-lesson-never-learned,daily,2024-09-13,"1 thought, 1 trend and 1 tool to carry you through to the weekend"
#032 - The new success formula for teens,https://opened.co/newsletter/new-success-formula-teens,daily,2024-09-16,"A lightbulb moment, Jay-Z's new philanthropic push, and math programs for the masses"
"#034 - Pandemic Pods, KaiPods, and iPods",https://opened.co/newsletter/pandemic-pods-kaipods-ipods,daily,2024-09-18,From portable music to portable classrooms. How education is stepping out of the box (and into the pod).
#033 - Thought–Trend–Tool: Tl;dr Tuesday edition,https://opened.co/newsletter/thoughttrendtool-tldr-tuesday-edition,daily,2024-09-17,"From sandwich stands to AI tutors and hands-on learning to the future of education. Plus, 25 ways to socialize your kids outside of a classroom."
#035 - Taste it. Feel it. Do it.,https://opened.co/newsletter/taste-feel,daily,2024-09-19,PODCAST: Mark Hyatt of Falcon AeroLab is on a mission to get kids in the sky.
#036 - Weekly Roundup: The new success formula for teens,https://opened.co/newsletter/weekly-roundup-the-new-success-formula-for-teens,daily,2024-09-20,"Curiosity beats curriculum. Explore how teens can thrive with hands-on projects, rethinking risk, and rising alternatives like pandemic pods and microschools."
#037 - Obsessive interest can be a superpower,https://opened.co/newsletter/obsessive-interest-can-be-a-superpower,daily,2024-09-23,"The value of ""deep dives,"" the State of the American Student, and a fun game to play at the beach"
#038 - How to start a business (with no ideas),https://opened.co/newsletter/how-to-start-a-business-with-no-ideas,daily,2024-09-24,"Becoming a ""problem detective"" – plus: Aiden Prout's $150,000 idea and our ultimate guide to marketing yourself"
#043 - The miracle ingredient in any environment,https://opened.co/newsletter/the-miracle-ingredient-in-any-environment,daily,2024-10-01,Mark Hyatt on trust. Plus: the danger of comparisons and sensory processing in neurodivergent kids
#039 - Saying 'yes' + cupcakes = recipe for success,https://opened.co/newsletter/saying-yes-cupcakes-recipe-for-success,daily,2024-09-25,The surprisingly delicious connection between baking and STEM education
#041 - From dyslexic dropouts to doctoral degrees at 17,https://opened.co/newsletter/from-dyslexic-dropouts-to-doctoral-degrees-at-17,daily,2024-09-27,"From a dyslexic dropout turned top chef to teen PhDs and student entrepreneurs—this issue celebrates saying yes, deep-focus learning, and hands-on STEM."
#042 - What parents and teens think about screen time,https://opened.co/newsletter/what-parents-and-teens-think-about-screen-time,daily,2024-09-30,"“Apple Vision Pro. Like, what even is that?”"
"#045 - Yes, you are qualified to teach your child",https://opened.co/newsletter/yes-you-are-qualified-to-teach-your-child,daily,2024-10-03,Matt & Isaac answer your questions on the OpenEd podcast
#044 - The cliffhanger technique for read-alouds,https://opened.co/newsletter/the-cliffhanger-technique-for-read-alouds,daily,2024-10-02,"Two kinds of memory, an update on standardized testing, and a read-aloud method to keep your kids on the edge of their seat"
#048 - From Moon Head to Main Character,https://opened.co/newsletter/from-moon-head-to-main-character,daily,2024-10-08,"When less (parenting) is more, the new success metrics, and the return of Mac Tonight"
#046 – Of Screen time and cliffhangers,https://opened.co/newsletter/of-screen-time-and-cliffhangers,daily,2024-10-04,"This week on OpenEd Daily: trust as the key to high-stakes learning, memory that builds understanding, Gen Z’s tech skepticism, testing “shell games,” and fresh tools for nature, sensory needs, and read-alouds."
#047 - Beyond mere choice,https://opened.co/newsletter/beyond-mere-choice,daily,2024-10-07,"Having choices in education is important, especially informed choices"
#049 - The (necessary) humility of Open Education,https://opened.co/newsletter/the-necessary-humility-of-open-education,daily,2024-10-09,"When to check your ego, plus: are traditional high schools finally getting the memo?"
#051 – The 10-minute rule,https://opened.co/newsletter/the-10-minute-rule,daily,2024-10-11,The value of alternating between intense focus and focused breaks - and much more.
#050 - The paradox of sacrifice,https://opened.co/newsletter/the-paradox-of-sacrifice,daily,2024-10-10,The growing appeal of outdoor education in an age of comfort and screens
"#052 - ""I wish school had taught me that""",https://opened.co/newsletter/i-wish-school-had-taught-me-that,daily,2024-10-14,50CAN's 'State of Educational Opportunity' report has arrived and it does not disappoint
#061 - The ROI of Personalized Education,https://opened.co/newsletter/the-roi-of-personalized-education,daily,2024-10-24,"For every five tradespeople who retire this year, two will replace them"
#054 - Why your GPA might not matter anymore (according to Google),https://opened.co/newsletter/why-your-gpa-might-not-matter-anymore-according-to-google,daily,2024-10-16,"The formula for fulfilling work, ADHD parenting summit, and some #facts about GPA"
#055 - How do I know if we're learning anything without grades/standardized tests?,https://opened.co/newsletter/how-do-i-know-if-we-re-learning-anything-without-grades-standardized-tests,daily,2024-10-17,Challenging the assumptions behind standardized testing
#060 - You don’t need to find the “right” curriculum,https://opened.co/newsletter/you-don-t-need-to-find-the-right-curriculum,daily,2024-10-23,"A radical idea from our latest podcast guest, plus the new helicopter parents and some tips on reading."
#066 - Doing division with a Star Wars twist,https://opened.co/newsletter/doing-division-with-a-star-wars-twist,daily,2024-10-31,How Charlynn Chambers uses real-world interests to teach math; plus the benefits of year-round learning
#057 - Weekly Roundup,https://opened.co/newsletter/weekly-roundup,daily,2024-10-18,"From mid-year enrollment to modern learning debates, this edition covers the real issue behind screen time, why standardized tests fall short, and career-readiness gaps. "
#063 - Math (without the misery),https://opened.co/newsletter/math-without-the-misery,daily,2024-10-28,"Learning centers find their groove, the perfectionism paradox, and a bonus meme/word of the day"
#064 - Custom education for single and working parents,https://opened.co/newsletter/custom-education-for-single-and-working-parents,daily,2024-10-29,A masterclass in opening your child's education from the Learning Division's own Sunny Simkins.
#067 - The perfect day is the enemy (plus: a 12-year-old built what?),https://opened.co/newsletter/the-perfect-day-is-the-enemy-plus-a-12-year-old-built-what-d715,daily,2024-11-01,"From redefining homeschool success to kids building SR-71 simulators, this edition covers thriving learning centers, Minecraft partnering with Stanford, and parent-friendly math inspiration."
#068 - Why kids who learn at home don’t get bullied as much,https://opened.co/newsletter/why-kids-who-learn-at-home-don-t-get-bullied-as-much,daily,2024-11-04,From escaping bullies to designing your own curriculum
#071 - Is reading a struggle? Check for these signs,https://opened.co/newsletter/is-reading-a-struggle-check-for-these-signs,daily,2024-11-07,One mom's refusal to accept a diagnosis led to an extraordinary breakthrough...
#069 - Is your kid a night owl?,https://opened.co/newsletter/is-your-kid-a-night-owl,daily,2024-11-05,"The virtues of a personalized schedule and the ""two-week rule"" for any new curriculum"
"#070 - Yes, you're qualified to teach your kids",https://opened.co/newsletter/yes-you-re-qualified-to-teach-your-kids,daily,2024-11-06,You don't need a master's degree to teach addition and subtraction
"#073 - What comes first, the lessons or the test?",https://opened.co/newsletter/new-post-1b5f,daily,2024-11-11,"The tutoring boom, Khan Academy's AI companion, and the 40-year quest to solve Bloom's ""2 sigma problem"""
"#074 - Try Different, Not Harder",https://opened.co/newsletter/try-different-not-harder,daily,2024-11-12,"From rooftop learning sessions to computer science math credits, plus the science behind your child's attention span"
#076 - The Four-Hour Revolution,https://opened.co/newsletter/the-four-hour-revolution,daily,2024-11-14,"How less time in ""school"" leads to more learning, why career counseling is broken, and the liberating truth about not ruining your kids"
#072 - Weekly Roundup: From Bullies to Night Owls,https://opened.co/newsletter/weekly-roundup-from-bullies-to-night-owls,daily,2024-11-08,"This week on OpenEd Daily: educational freedom reducing bullying, a powerful dyslexia breakthrough story, confidence for parent-teachers, trends in student-designed courses and career credentials."
#075 - How to create a high school transcript,https://opened.co/newsletter/new-post-7ac8,daily,2024-11-13,"Roadschooling revolutionaries in Spain, and the art of translating real learning into transcripts"
"Roadschoolers, Rebels & Rooftop Classes",https://opened.co/newsletter/roadschoolers-rebels-rooftop-classes,daily,2024-11-15,"The weekly roundup of unconventional wisdom, practical tools, and permission to teach differently"
#080 - 3 words to transform conversations with your kids,https://opened.co/newsletter/new-post-103c,daily,2024-11-20,"A conversation tip from a veteran homeschool mom, why Gen Z is obsessed with aesthetics, plus a peek inside the ""teacherless"" Acton Academy model."
#079 - The Hidden Value of Chores,https://opened.co/newsletter/the-hidden-value-of-chores,daily,2024-11-19,"Why doing laundry might matter more than AP scores, teaching multiple kids without losing your mind, and the skill colleges and employers actually want (but can't measure)."
#081 - To shield or to share? That is the question.,https://opened.co/newsletter/to-shield-or-to-share-that-is-the-question,daily,2024-11-21,"Why hiding your struggles from your kids might backfire, the power of trusting your parental instincts, and a free tool that turns music theory into play."
#082 – Chores Before AP Scores,https://opened.co/newsletter/new-post-f654,daily,2024-11-22,"Plus: 3 magic words to engage your kids, Gen Z's identity crisis, a father's manifesto, grade inflation exposed, and why sharing struggles might be good parenting"
#083 - Is there life on MARS?,https://opened.co/newsletter/is-there-life-on-mars,daily,2024-11-25,"Hybrid schools are evolving beyond part-time/home combos, the 7-hour school day myth gets debunked, plus a surprisingly simple reading hack from a Montessori expert."
#084 - The real reason we assign homework,https://opened.co/newsletter/the-real-reason-we-assign-homework,daily,2024-11-26,"Why ""quiet children"" might not exist, a novel theory about homework, plus a treasure trove of free classical education resources that have stood the test of time."
#085 - The old man who outsmarted his bullies,https://opened.co/newsletter/the-old-man-who-outsmarted-his-bullies,daily,2024-11-27,"When rewards kill motivation, Kentucky's education revolution, plus a home-based Montessori makeover anyone can do."
#087 - Screen Time: Quality Over Quantity (+ SpaceX's Math Revolution),https://opened.co/newsletter/screen-time-quality-over-quantity-spacex-s-math-revolution,daily,2024-12-02,"A tech founder's controversial take on screen time, Sweden's surprising pivot, and how SpaceX is reinventing math education"
#086 - The Element of Surprise,https://opened.co/newsletter/the-element-of-surprise,daily,2024-11-28,"A mother's love revolutionizes education, real-world learning beats textbooks by 8%, and why scientists used to mail radioactive elements (yes, really)"
#088 - The case against grammar worksheets (and what to do instead),https://opened.co/newsletter/the-case-against-grammar-worksheets-and-what-to-do-instead,daily,2024-12-03,"Schools built for compliance, why letting kids walk boosts success, and the delightfully nerdy pluperfect subjunctive."
#090 - The 3 R's Are All You Need,https://opened.co/newsletter/the-3-r-s-are-all-you-need,daily,2024-12-05,"Plus, why AP tests cost so much, and how to take better notes"
#089 - When Teachers Stop Teaching,https://opened.co/newsletter/when-teachers-stop-teaching,daily,2024-12-04,"A veteran educator finds magic in stepping back, plus our must-read book list for home education."
"#095 - The Power of 'Yes, And'",https://opened.co/newsletter/the-power-of-yes-and,daily,2024-12-12,"The education buffet is open: How families are mixing homeschool, public school, and everything in between..."
