title,url,type,date,summary
Finding Your Child's Superpower: Why 'Average' Students Need Specialized Attention,https://opened.co/podcast/finding-your-childs-superpower,podcast,2025-08-19,"Charter school founder Mike Goldstein reveals education's blind spot: Schools have programs for struggling students and gifted kids, but the vast middle—the ""average"" students—get nothing. Here's why that's a crisis."
The 5 fears killing your homeschool confidence,https://opened.co/newsletter/the-5-fears-killing-your-homeschool-confidence,daily,2025-08-16,
Deep Dive: How to Start Homeschooling With Confidence,https://opened.co/newsletter/deep-dive-how-to-start-homeschooling-with-confidence,daily,2025-08-14,Learn how to start homeschooling with confidence even if you're scared or new. Overcome the 5 biggest homeschool fears with practical tips from experienced mom and coach Meg Thomas.
"Dyslexia guide, two-hour school days, and a $71B dropout",https://opened.co/newsletter/dyslexia-guide-two-hour-school-days-and-a-71b-dropout,daily,2025-08-09,
College-for-All Is Breaking. What Replaces It?,https://opened.co/podcast/college-for-all-is-breaking-what-replaces-it,podcast,2025-08-14,"Education experts Michelle Rhee and Michael Horn discuss career alternatives to college, apprenticeships, and preparing teens for tomorrow's job market."
How to Start Homeschooling With Confidence (Even If You're Scared or New) ,https://opened.co/blog/how-to-start-homeschooling-with-confidence-even-if-youre-scared-or-new,blog,2025-08-13,New homeschoolers: Build confidence and overcome fears with coach Meg Thomas's proven strategies. Get practical advice for starting your homeschool journey successfully.
Parents Guide to Homeschooling Students with Dyslexia,https://opened.co/newsletter/deep-dive-dyslexia-resources-for-homeschool-parents,daily,2025-08-07,Guide to Homeschooling Students with Dyslexia
College dropout becomes billionaire (again),https://opened.co/newsletter/college-dropout-becomes-billionaire-again,daily,2025-08-05,Figma founder Dylan Field becomes 4th Thiel Fellowship billionaire dropout. Explore 7 alternative career paths that skip college and build real-world skills.
The future-proof career prep guide for teens,https://opened.co/newsletter/the-future-proof-career-prep-guide-for-teens,daily,2025-08-02,"Homeschool news: NYT article response, 7 future-proof career prep strategies, plus tools and trends for families choosing educational alternatives."
"🐴 ""That's not knowledge"" — MythBusters' Adam Savage goes viral.",https://opened.co/newsletter/thats-not-knowledge----mythbusters-adam-savage-goes-viral,daily,2025-04-18,"Adam Savage critiques standardized tests, Thiel Fellowship creates 11 billion-dollar companies, plus AI tutoring and homeschool socialization insights."
🐴 The factory model of education is dying,https://opened.co/newsletter/the-factory-model-of-education-is-dying,daily,2025-05-05,The surprising reason 40% of students are leaving traditional schools. PLUS: the video game that's teaching kids to overcome frustration...
🐴 Hands-on learning (backyard chickens edition),https://opened.co/newsletter/hands-on-learning-backyard-chickens-edition,daily,2025-05-07,"Backyard chickens for homeschool: Teach math, science, and business skills through hands-on chicken keeping. Get our complete starter guide and resources."
🐴 Are we teaching STEM backwards?,https://opened.co/newsletter/are-we-teaching-stem-backwards,daily,2025-05-08,An interview with Jack Casdorph and Rachael Davie on why theory-first education fails and how projects spark real curiosity
🐴 The 200-year-old mistake we're still making,https://opened.co/newsletter/the-200-year-old-mistake-were-still-making,daily,2025-05-15,"A conversation with Matt Bowman and Isaac Morehouse on the history of schooling, standardization, and the power of ""not yet""
"
🐴 Balancing remote work and parenting,https://opened.co/newsletter/balancing-remote-work-and-parenting,daily,2025-05-21,Teachers share the reality of WFH parenting success.
🐴 OpenEd Academy: the school that adapts to YOUR child (not the other way around),https://opened.co/newsletter/opened-academy-the-school-that-adapts-to-your-child-not-the-other-way-around,daily,2025-05-22,Introducing our new virtual private school—nationwide enrollment now open! Plus: $100 free Outschool credits
🐴 What happens when a school actually trusts parents?,https://opened.co/newsletter/what-happens-when-a-school-actually-trusts-parents,daily,2025-05-23,Teresa King reveals education's trust problem. PLUS: OpenEd teachers share genius work-from-home hacks.
🐴 *Tuttle Twins* author on the two modes of learning,https://opened.co/newsletter/tuttle-twins-author-on-the-two-modes-of-learning,daily,2025-05-28,"Connor Boyack's simple analogy exposes a major flaw in the way we teach. PLUS: Kids building real businesses, not resumes."
🐴 Why kids forget what they learn in textbooks,https://opened.co/newsletter/why-kids-forget-what-they-learn-in-textbooks,daily,2025-05-29,Connor Boyack – the Tuttle Twins creator – on why storytelling makes learning sticks where lesson plans often fail...
The Homeschool Parent's Guide to Dyslexia: When to DIY vs. When to Call the Experts,https://opened.co/blog/the-homeschool-parents-guide-to-dyslexia-when-to-diy-vs-when-to-call-the-experts,blog,2025-08-06,"Homeschool dyslexia guide: Learn when to DIY vs. hire specialists, spot red flags, choose reading programs like Barton and Wilson, plus get expert resources."
Dispelling Dyslexia Myths with the Science of Reading,https://opened.co/podcast/dispelling-dyslexia-myths-with-the-science-of-reading,podcast,2025-08-06,"Reading specialists Kris Vassel and Jamie Lesko debunk misconceptions around dyslexia, and explain why early intervention can change everything"
9 Future-Proof Career Prep Strategies for Homeschooled Teens,https://opened.co/blog/homeschool-career-prep-future-proof,blog,2025-08-01,"Career prep for the AI age: 9 experts share alternatives to college including skilled trades, tech certifications, apprenticeships, and entrepreneurship paths."
🐴 He let his kids skip school. They still made student council.,https://opened.co/newsletter/he-let-his-kids-skip-school-they-still-made-student-council,daily,2025-08-01,
🐴 Textbooks vs. Chromebooks,https://opened.co/newsletter/textbooks-vs-chromebooks,daily,2025-07-29,
🐴 When 'sit still!' stops working,https://opened.co/newsletter/when-sit-still-stops-working,daily,2025-07-30,
What the New York Times got wrong about homeschooling,https://opened.co/blog/what-the-new-york-times-got-wrong-about-homeschooling,blog,2025-07-30,Why recent homeschooling coverage misses the mark: Families aren't retreating from education—they're personalizing it across the political spectrum.
I Let My Kids Skip School. They Still Made Student Council.,https://opened.co/podcast/kids-skipped-school,podcast,2025-07-31,How a speaking coach's journey from traditional schooling to educational freedom became the ultimate lesson in turning a message into a movement.
Skills Over Degrees: The New Career Reality,https://opened.co/newsletter/skills-over-degrees-the-new-career-reality,daily,2025-06-06,"From career clarity for teens to AI tutors that ease learning anxiety, this issue covers Coleman’s “three wires,” the shift away from degrees, top resources families clicked most, and eye-opening trend data."
🐴 Stop raising well-rounded kids,https://opened.co/newsletter/stop-raising-well-rounded-kids,daily,2025-06-05,"""I don't want a well-rounded kid,"" says career expert Ken Coleman. The world pays for sharp edges, not blunt tools. PLUS: The parenting shift that's creating anxious kids.
"
🐴 Everyone said he’d fail. He didn’t.,https://opened.co/newsletter/everyone-said-hed-fail-he-didnt,daily,2025-06-04,"Could fitness culture make a comeback in schools? Plus: a better way to teach essays, and a math tutor used by 8 million people.
"
🐴 Why do we focus on the 10% (when kids remember 95%)?,https://opened.co/newsletter/why-do-we-focus-on-the-10-when-kids-remember-95,daily,2025-06-03,Why teaching beats studying; an AI tutor that never judges. PLUS: Free Harvard courses.
🐴 Why art history grads are beating engineers,https://opened.co/newsletter/why-art-history-grads-are-beating-engineers,daily,2025-06-02,The market’s shifting. Soft skills are back. PLUS: Matt Bowman's 3 C's for faster learning.
"🐴 Parents as curators, not classroom instructors",https://opened.co/newsletter/parents-as-curators-not-classroom-instructors,daily,2025-07-11,The evolution of modern homeschooling. PLUS: Michelle Rhee's teaching transformation.
🐴 22-year-old George Washington's epic failure (it didn't define him),https://opened.co/newsletter/22-year-old-george-washingtons-epic-failure-it-didnt-define-him,daily,2025-07-04,How Young George accidentally started a world war. PLUS: A recap of the best links from the first half of 2025.
🐴 George Washington's epic failure,https://opened.co/newsletter/george-washingtons-epic-failure,daily,2025-07-02,George Washington accidentally started a world war. PLUS: Why Hollywood's gatekeepers are losing power.
🐴 Steve Jobs cut 70% of products. It saved Apple.,https://opened.co/newsletter/steve-jobs-cut-70-of-products-it-saved-apple,daily,2025-06-30,How brutal simplicity led to the turnaround of the century. PLUS: Why schools fail entrepreneurs every day.
🐴 Mythbusting 'one size fits all',https://opened.co/newsletter/mythbusting-one-size-fits-all,daily,2025-06-27,"MythBusters host Adam Savage's epic rant against standardized schooling. PLUS: Paper beats screens, movement beats sitting, and other surprises from this week."
🐴 How savvy parents are tutoring their kids,https://opened.co/newsletter/how-savvy-parents-are-tutoring-their-kids,daily,2025-06-26,The counterintuitive way to boost your child's reading progress. PLUS: Free reading assessment to know exactly what level they're at.
🐴 Mark Twain summer reading edition,https://opened.co/newsletter/mark-twain-summer-reading-edition,daily,2025-06-25,"Who really said, “Don’t let school interfere with your education”? Plus: deepfakes in school, why fidgeting helps learning, and our favorite Mark Twain picks for summer."
🐴 What happens when kids care?,https://opened.co/newsletter/what-happens-when-kids-care,daily,2025-06-24,Why motivation beats mandates every time. Plus: Homeschooling goes mainstream + science-backed learning
🐴 Print books beat screens for memory,https://opened.co/newsletter/print-books-beat-screens-for-memory,daily,2025-06-23,"What the NASA blooper reel says about real learning. PLUS: Why paper beats pixels, and Orwell's writing secret."
🐴 Is college the only path to success?,https://opened.co/newsletter/is-college-the-only-path-to-success,daily,2025-06-20,"The definition of ""career-ready"" is changing fast. Are we keeping up? PLUS: Standardized tests are back, and top tools for charting your own course."
🐴 High school juniors landing $70k jobs,https://opened.co/newsletter/high-school-juniors-landing-70k-jobs,daily,2025-06-19,Discover why dead ends might be your teen's most valuable learning experience. PLUS: Free career exploration tools beyond the traditional college route.
"🐴 ""My kids learned more when I backed off""",https://opened.co/newsletter/my-kids-learned-more-when-i-backed-off,daily,2025-07-18,How stepping back unlocks your child's genius. PLUS: The lighting change that calms fidgety kids overnight.
🐴 Why Most Kids Hate Math (and How to Fix It),https://opened.co/newsletter/why-most-kids-hate-math-and-how-to-fix-it,daily,2025-06-17,Most kids don't actually hate numbers—they hate how we teach them. PLUS: Three tools that make math finally click.
🐴 The four types of screen time,https://opened.co/newsletter/the-four-types-of-screen-time,daily,2025-06-16,A smarter way to judge screen time. PLUS: SAT tests are back & libraries fund startups.
🐴 The 3-part remedy for burnout,https://opened.co/newsletter/the-3-part-remedy-for-burnout,daily,2025-06-12,"Homeschool coach Meg Thomas shares why connection beats curriculum, plus decluttering for calmer kids, screen-time regulation insights, and 3 tools."
Stop stressing. Start designing. (A mom of 7 explains),https://opened.co/newsletter/stop-stressing-start-designing-a-mom-of-7-explains,daily,2025-06-13,"From spa-calm homeschool spaces to kids begging for more math, this edition covers environment-first learning, Gen Z choosing clarity over alcohol, AI-era education trends, and practical tools for independence and inspiration."
The #1 life skill to turn your child into a confident learner,https://opened.co/podcast/the-1-life-skill-to-turn-your-child-a-confident-learner,podcast,2025-07-18,Is cooking the solution to America's youth anxiety crisis? Katie Kimball thinks so.
What to Do When Your Students Don't Respect You (Michelle Rhee's Story),https://opened.co/podcast/what-to-do-when-your-students-dont-respect-you-michelle-rhees-story,podcast,2025-07-11,Lessons from Michelle Rhee's transformation from classroom disaster to education champion
From Viral Ads to Revolutionary Education: A Conversation with Benton Crane,https://opened.co/podcast/benton-crane-from-viral-ads-to-young-washington,podcast,2025-07-04,"The producer of the upcoming Young Washington movie gives advice to young people on how to overcome failure, and get past the gatekeepers to succeed in 2025 and beyond."
5 Myths Keeping Your Child From Reading Success (And the 25-Minute Solution),https://opened.co/podcast/5-myths-keeping-your-child-from-reading-success-and-the-25-minute-solution,podcast,2025-06-26,The Hidden Reading Crisis Every Parent Needs to Know About
College and Career Advice for Teens with Rose Ybaben (ft. Danielle Randall),https://opened.co/podcast/college-and-career-advice-for-teens-with-rose-ybaben-and-danielle-rose,podcast,2025-06-19,5 Counterintuitive Truths About Post-High School Planning That Most Parents Miss
Why Kids Hate Math—and 20 Resources to Help Fix It,https://opened.co/blog/why-kids-hate-math--and-20-resources-to-help-fix-it,blog,2025-06-17,Kids don't hate math—they hate how it's taught. Discover 20 play-based math tools ranked by homeschool parents to turn frustration into fascination.
Meg Thomas’s 3-Part Framework for Calm Homeschooling,https://opened.co/podcast/meg-thomass-3-part-framework-for-calm-homeschooling,podcast,2025-06-13,"A veteran homeschool mom of 7 reveals the real foundation of learning: connection, routines, and environment, with simple tools for calm."
🐴 His Tremor Tanked His Art. Then It Made Him.,https://opened.co/newsletter/his-tremor-tanked-his-art-then-it-made-him,daily,2025-06-11,An artist embraced his 'fatal flaw.' PLUS: Montessori's identity crisis & why some parents are ditching school for good.
🐴 Twain was right: Don't let schooling interfere with your education,https://opened.co/newsletter/twain-was-right-dont-let-schooling-interfere-with-your-education,daily,2025-06-10,The 200-year-old system is cracking. Here's what's replacing it. PLUS: Why Gen Z is saying no to alcohol (and yes to clarity).
🐴 Kids begged for more math when teachers did this.,https://opened.co/newsletter/kids-begged-for-more-math-when-teachers-did-this,daily,2025-06-09,"A simple grouping trick transforms math learning. PLUS: Why modeling self-care matters, and new data in the nature vs. nurture debate."
What Returning Families Need To Know for the 25-26 School Year,https://opened.co/blog/what-returning-families-need-to-know-for-the-25-26-school-year,announcements,2025-06-09,"If your family is coming back for another year of personalized learning with OpenEd, welcome! We’re glad to serve you again!"
7 Things Career Expert Ken Coleman Says Parents Get Wrong (And How to Fix Them),https://opened.co/podcast/7-things-career-expert-ken-coleman-says-parents-get-wrong-and-how-to-fix-them,podcast,2025-06-05,"Stop fixing your kid's weaknesses. Ramsey Solutions expert Ken Coleman explains why the world pays for 9s and 10s, not 5s. Plus his 3-wire career framework."
🐴 We need to talk about educational autopilot,https://opened.co/newsletter/we-need-to-talk-about-educational-autopilot,daily,2025-05-30,Connor Boyack exposes the conveyor belt trap. PLUS: Teen CEOs building empires before they can drive...
5 Questions with Tuttle Twins Creator Connor Boyack,https://opened.co/podcast/5-questions-with-tuttle-twins-creator-connor-boyack,podcast,2025-05-29,
🐴 The cure for childhood entitlement,https://opened.co/newsletter/the-cure-for-childhood-entitlement,daily,2025-05-27,Matt Bowman goes LIVE with Coach Meg Thomas TODAY at 11am MT. PLUS: The surprising brain science behind teen happiness
How OpenEd Teachers Master the Work-From-Home Juggle,https://opened.co/blog/how-opened-teachers-master-the-work-from-home-juggle,blog,2025-05-23,"22 teachers share battle-tested strategies for working from home with kids. Get practical tips for boundaries, schedules, and turning chaos into productivity."
The school that trusts parents to design their child's education,https://opened.co/podcast/opened-academy,podcast,2025-05-21,Announcing the OpenEd Academy - a virtual private school accepting nation-wide enrollment for the 2025-2026 school year.
When the Smartest Person in the World Called Out Our Schools,https://opened.co/blog/when-the-smartest-person-in-the-world-called-out-our-schools,blog,2025-05-20,World's smartest person Marilyn vos Savant reveals 5 education lessons from the famous Monty Hall problem: Why passive schooling kills critical thinking.
The 228 IQ genius who warned us about schools,https://opened.co/newsletter/the-228-iq-genius-who-warned-us-about-schools,daily,2025-05-20,"How Marilyn vos Savant correctly solved the puzzle 1,000 PhDs got wrong + what it reveals about education's fatal flaw... PLUS: The Monty Hall solution revealed 3 Quick Bites: 🍎 How the world's highest IQ exposed the passive trap of compulsory schooling
🍎 The famous math problem that proves why independent thinking matters
🍎 Why teaching children to analyze different perspectives builds true intelligence"
Humans aren't Model Ts,https://opened.co/newsletter/humans-arent-model-ts,daily,2025-05-19,"The surprising lesson one dad learned from a $3.99 game + why educational disruption is finally happening... PLUS: Today's trivia could win you $10K (if you ignore your math professor) 3 Quick Bites: 🍎 Why treating students like assembly line products costs us everything
🍎 The $3.99 game that teaches what schools rarely do: productive frustration
🍎 40% of students have left traditional schools—and it's just the beginning"
🐴 Why our book hit #1 (hint: thanks to you),https://opened.co/newsletter/why-our-book-hit-1-hint-thanks-to-you,daily,2025-05-16,"Plus free ""Ed the horse"" t-shirt for book reviewers!"
🏆 #1 bestseller!,https://opened.co/newsletter/1-bestseller,daily,2025-05-14,"Plus: ""Open Education"" paperback now available! (99¢ ebook extended)"
🐴 It's here 🎉,https://opened.co/newsletter/its-here,daily,2025-05-13,Get your copy of Open Education for 99 cents (launch day only)
🐴 Tomorrow: Break Free from One-Size-Fits-All Education (Special Book Launch!),https://opened.co/newsletter/tomorrow-break-free-from-one-size-fits-all-education-special-book-launch,daily,2025-05-12,Learn how to design a personalized learning journey that celebrates your child's uniqueness. PLUS: Exclusive launch bonuses available tomorrow only!
🐴 From tree houses to chicken coops - learning by doing,https://opened.co/newsletter/from-tree-houses-to-chicken-coops---learning-by-doing,daily,2025-05-09,The powerful template for math and science education hiding in your backyard...
"The 200-Year-Old Trap: Breaking Down Part One of ""Open Education""",https://opened.co/podcast/the-200-year-old-trap-breaking-down-part-one-of-open-education,podcast,2025-05-15,"A conversation with Isaac Morehouse and Matt Bowman on their new book, the history of schooling, standardization, and the power of ""not yet"""
Have We Been Teaching STEM Backwards? The Case for Project-Based Learning,https://opened.co/podcast/have-we-been-teaching-stem-completely-backwards-the-case-for-project-based-learning,podcast,2025-05-08,Jack Casdorph on why theory-first education fails and how projects spark real curiosity
Backyard Chickens: The Ultimate Hands-On Homeschooling Project?,https://opened.co/blog/backyard-chickens-the-ultimate-hands-on-homeschooling-project-2,blog,2025-05-07,"If you're looking for an educational project that combines science, math, business, construction, responsibility, and occasional moments of running through your yard screaming ""THE CHICKEN IS LOOSE!"" – look no further than backyard chickens. Read on to learn why raising chickens creates uniquely effective learning opportunities - and how to get started with your own flock."
Backyard Chickens: The Ultimate Hands-On Homeschooling Project?,https://opened.co/blog/backyard-chickens-the-ultimate-hands-on-homeschooling-project,blog,2025-05-07,"If you're looking for an educational project that combines science, math, business, construction, responsibility, and occasional moments of running through your yard screaming ""THE CHICKEN IS LOOSE!"" (P.E.?) – look no further than backyard chickens."
🐴 The case for MORE screens?,https://opened.co/newsletter/the-case-for-more-screens,daily,2025-05-02,"""Not all screen time is created equal,"" says Outschool CEO. See why the distinction matters, and which classes are revolutionizing how kids learn. PLUS: Dave Ramsey's ""worth test"" for college."
"🐴 Bigfoot, Wizard Cooking, and a Minecraft Modding Class",https://opened.co/newsletter/bigfoot-wizard-cooking-and-a-minecraft-modding-class,daily,2025-05-01,"How Outschool.com is upending the world of alternative education (and our perception of ""screen time""). PLUS: Welcome to the era of Networked Schooling."
🐴 Screens have taken over classrooms,https://opened.co/newsletter/screens-have-taken-over-classrooms,daily,2025-04-30,
🐴 Open Education: The Book Launch Countdown Begins,https://opened.co/newsletter/open-education-the-book-launch-countdown-begins,daily,2025-04-29,"Mark your calendars! On May 13, Matt Bowman and Isaac Morehouse will launch their new book, *Open Education: How to Reimagine Learning, Ignite Curiosity, and Prepare Your Kids for Success."
"🐴 Dave Ramsey: ""We're fools about education""",https://opened.co/newsletter/dave-ramsey-were-fools-about-education,daily,2025-04-28,"The college question isn't yes/no, it's ""what am I getting for what I'm paying?"" PLUS: The financial education curriculum that schools aren't teaching"
"🐴 Protecting the ""Internal Spark""",https://opened.co/newsletter/protecting-the-internal-spark,daily,2025-04-25,"From calculator protests to Nobel Prize winners, what history teaches us about the tools (and fears) that shape education..."
"🐴 Are we making our kids more anxious by keeping them ""safe""?",https://opened.co/newsletter/are-we-making-our-kids-more-anxious-by-keeping-them-safe,daily,2025-04-24,"The definition of anxiety is thinking there will be something scary that you won't be able to deal with."" Lenore Skenazy on why overprotection might be the real danger. Plus: How hybrid homeschool communities are reimagining education."
Coming Soon: OpenEd’s New Platform!,https://opened.co/blog/coming-soon-openeds-new-platform,blog,2025-02-07,
What Makes a Thriving Homeschool Collective? | Cassie Tinsmon,https://opened.co/podcast/what-makes-a-thriving-homeschool-collective-cassie-tinsmon,podcast,2025-04-24,How one mother is redefining education by removing the boundaries between learning and living
Stop Limiting Your Child's Screen Time (Do This Instead),https://opened.co/podcast/dont-limit-screentime,podcast,2025-04-30,"How companies like Outschool are giving parents more options than just ""school vs. homeschool"""
Homeschool Kindergarten Without Walls: Freedom as the Ultimate Curriculum,https://opened.co/blog/homeschool-kindergarten-curriculum,blog,2025-04-27,"Is early academics helping or hurting your child? Explore why play, freedom, and curiosity may be the true foundation of kindergarten readiness—and how to create a rich homeschool learning environment without worksheets."
A Sneak Peek at the 2025 Marketplace!,https://opened.co/blog/a-sneak-peek-at-the-2025-marketplace,announcements,2025-04-28,"You may have heard (or read!) about our new approach to curriculum access — a dynamic marketplace of resources coming to the OpenEd platform for the 2025-2026 program year. Today, I’m thrilled to take it one step further and give you a sneak peek at what’s inside!
"
No One “Right Way” to Learn,https://opened.co/newsletter/no-one-right-way-to-learn,daily,2024-08-06,"Learn what’s driving the shift to open education: eclectic homeschooling ideas, the rise of parent “customizers,” and a LEGO-backed study revealing kids want more hands-on, self-directed, creative learning."
"🍎 Redefining ""Back-to-School""",https://opened.co/newsletter/redefining-back-to-school,daily,2024-08-19,"Flexible learning, personalized spaces, and joyful traditions."
#040 - How to encourage reluctant readers,https://opened.co/newsletter/040---how-to-encourage-reluctant-readers,daily,2024-09-26,Reading rebels and academic prodigies – nurturing learners at every age
#058 - How to get your child to take you seriously as the 'teacher',https://opened.co/newsletter/058---how-to-get-your-child-to-take-you-seriously-as-the-teacher,daily,2024-10-21,"Flexibility, Blurry Education Lines, and Teaching Tips from /r/homeschool"
